{
  "capsule_version": "1",
  "generated_at": "2026-10-15T07:25:41+00:00",
  "repository": {
    "path_name": "LinkWatch",
    "remote": "https://github.com/rishrek/LinkWatch.git",
    "commit": "f52f3930c8e7c33d934ccf614955a38e26984bd5",
    "dirty": true
  },
  "dependencies": {
    "manifests": [
      "requirements-dev.txt",
      "requirements.txt",
      "pyproject.toml"
    ],
    "python_requires": ">=3.10",
    "items": [
      {
        "name": "pytest",
        "specifier": "",
        "pinned_version": null,
        "marker": null,
        "kind": "dev",
        "file": "requirements-dev.txt",
        "line": 1,
        "resolved_version": "9.1.1"
      },
      {
        "name": "nose",
        "specifier": "==1.3.7",
        "pinned_version": "1.3.7",
        "marker": null,
        "kind": "dev",
        "file": "requirements-dev.txt",
        "line": 2,
        "resolved_version": "1.3.7"
      },
      {
        "name": "toml",
        "specifier": "==0.10.2",
        "pinned_version": "0.10.2",
        "marker": null,
        "kind": "runtime",
        "file": "requirements.txt",
        "line": 1,
        "resolved_version": "0.10.2"
      },
      {
        "name": "appdirs",
        "specifier": "==1.4.4",
        "pinned_version": "1.4.4",
        "marker": null,
        "kind": "runtime",
        "file": "requirements.txt",
        "line": 2,
        "resolved_version": "1.4.4"
      },
      {
        "name": "requests",
        "specifier": "==2.31.0",
        "pinned_version": "2.31.0",
        "marker": null,
        "kind": "runtime",
        "file": "requirements.txt",
        "line": 3,
        "resolved_version": "2.31.0"
      },
      {
        "name": "jinja2",
        "specifier": "==2.11.3",
        "pinned_version": "2.11.3",
        "marker": null,
        "kind": "runtime",
        "file": "requirements.txt",
        "line": 4,
        "resolved_version": "2.11.3"
      },
      {
        "name": "pydantic",
        "specifier": "==1.10.13",
        "pinned_version": "1.10.13",
        "marker": null,
        "kind": "runtime",
        "file": "requirements.txt",
        "line": 5,
        "resolved_version": "1.10.13"
      },
      {
        "name": "click",
        "specifier": ">=7",
        "pinned_version": null,
        "marker": null,
        "kind": "runtime",
        "file": "requirements.txt",
        "line": 6,
        "resolved_version": "8.5.0"
      },
      {
        "name": "six",
        "specifier": "",
        "pinned_version": null,
        "marker": null,
        "kind": "runtime",
        "file": "requirements.txt",
        "line": 7,
        "resolved_version": "1.17.0"
      },
      {
        "name": "chardet",
        "specifier": "==5.2.0",
        "pinned_version": "5.2.0",
        "marker": null,
        "kind": "runtime",
        "file": "requirements.txt",
        "line": 8,
        "resolved_version": "5.2.0"
      },
      {
        "name": "setuptools",
        "specifier": "==75.8.0",
        "pinned_version": "75.8.0",
        "marker": null,
        "kind": "runtime",
        "file": "requirements.txt",
        "line": 9,
        "resolved_version": "75.8.0"
      },
      {
        "name": "idna",
        "specifier": "==2.7",
        "pinned_version": "2.7",
        "marker": null,
        "kind": "runtime",
        "file": "requirements.txt",
        "line": 10,
        "resolved_version": "2.7"
      },
      {
        "name": "python-dateutil",
        "specifier": "",
        "pinned_version": null,
        "marker": null,
        "kind": "runtime",
        "file": "requirements.txt",
        "line": 11,
        "resolved_version": "2.9.0.post0"
      },
      {
        "name": "rich",
        "specifier": "",
        "pinned_version": null,
        "marker": null,
        "kind": "runtime",
        "file": "requirements.txt",
        "line": 12,
        "resolved_version": "15.0.0"
      },
      {
        "name": "toml",
        "specifier": "==0.10.2",
        "pinned_version": "0.10.2",
        "marker": null,
        "kind": "runtime",
        "file": "pyproject.toml",
        "line": 13,
        "resolved_version": "0.10.2"
      },
      {
        "name": "appdirs",
        "specifier": "==1.4.4",
        "pinned_version": "1.4.4",
        "marker": null,
        "kind": "runtime",
        "file": "pyproject.toml",
        "line": 14,
        "resolved_version": "1.4.4"
      },
      {
        "name": "requests",
        "specifier": "==2.31.0",
        "pinned_version": "2.31.0",
        "marker": null,
        "kind": "runtime",
        "file": "pyproject.toml",
        "line": 15,
        "resolved_version": "2.31.0"
      },
      {
        "name": "jinja2",
        "specifier": "==2.11.3",
        "pinned_version": "2.11.3",
        "marker": null,
        "kind": "runtime",
        "file": "pyproject.toml",
        "line": 16,
        "resolved_version": "2.11.3"
      },
      {
        "name": "pydantic",
        "specifier": ">=2",
        "pinned_version": null,
        "marker": null,
        "kind": "runtime",
        "file": "pyproject.toml",
        "line": 17,
        "resolved_version": "1.10.13"
      },
      {
        "name": "click",
        "specifier": ">=7",
        "pinned_version": null,
        "marker": null,
        "kind": "runtime",
        "file": "pyproject.toml",
        "line": 18,
        "resolved_version": "8.5.0"
      },
      {
        "name": "six",
        "specifier": "",
        "pinned_version": null,
        "marker": null,
        "kind": "runtime",
        "file": "pyproject.toml",
        "line": 19,
        "resolved_version": "1.17.0"
      },
      {
        "name": "chardet",
        "specifier": "==5.2.0",
        "pinned_version": "5.2.0",
        "marker": null,
        "kind": "runtime",
        "file": "pyproject.toml",
        "line": 20,
        "resolved_version": "5.2.0"
      },
      {
        "name": "setuptools",
        "specifier": "==75.8.0",
        "pinned_version": "75.8.0",
        "marker": null,
        "kind": "runtime",
        "file": "pyproject.toml",
        "line": 21,
        "resolved_version": "75.8.0"
      },
      {
        "name": "idna",
        "specifier": "==2.7",
        "pinned_version": "2.7",
        "marker": null,
        "kind": "runtime",
        "file": "pyproject.toml",
        "line": 22,
        "resolved_version": "2.7"
      },
      {
        "name": "python-dateutil",
        "specifier": "",
        "pinned_version": null,
        "marker": null,
        "kind": "runtime",
        "file": "pyproject.toml",
        "line": 23,
        "resolved_version": "2.9.0.post0"
      },
      {
        "name": "rich",
        "specifier": "",
        "pinned_version": null,
        "marker": null,
        "kind": "runtime",
        "file": "pyproject.toml",
        "line": 24,
        "resolved_version": "15.0.0"
      }
    ],
    "parse_issues": []
  },
  "risk_evidence": {
    "indicators": [
      {
        "package": "pydantic",
        "indicator": "conflicting_constraints",
        "severity": "warn",
        "evidence": [
          "requirements.txt pins 1.10.13 but pyproject.toml requires '>=2'"
        ]
      },
      {
        "package": "certifi",
        "indicator": "imported_but_undeclared",
        "severity": "warn",
        "evidence": [
          "linkwatch/checker.py:4"
        ]
      },
      {
        "package": "idna",
        "indicator": "no_static_import_found",
        "severity": "info",
        "evidence": [
          "declared in manifest; no static import found (not proof of non-use)"
        ]
      },
      {
        "package": "nose",
        "indicator": "no_static_import_found",
        "severity": "info",
        "evidence": [
          "declared in manifest; no static import found (not proof of non-use)"
        ]
      },
      {
        "package": "six",
        "indicator": "no_static_import_found",
        "severity": "info",
        "evidence": [
          "declared in manifest; no static import found (not proof of non-use)"
        ]
      },
      {
        "package": "requests",
        "indicator": "private_api_import",
        "severity": "warn",
        "evidence": [
          "linkwatch/encoding.py:5 imports requests.utils._parse_content_type_header"
        ]
      },
      {
        "package": "jinja2",
        "indicator": "observed_in_baseline_output",
        "severity": "high",
        "evidence": [
          "E   ImportError: cannot import name 'soft_unicode' from 'markupsafe' (<tmp>\\venv\\Lib\\site-packages\\markupsafe\\__init__.py)",
          "..\\venv\\Lib\\site-packages\\jinja2\\filters.py:13: ImportError"
        ]
      },
      {
        "package": "setuptools",
        "indicator": "observed_in_baseline_output",
        "severity": "high",
        "evidence": [
          "<tmp>\\repo\\linkwatch\\resources.py:1: DeprecationWarning: pkg_resources is deprecated as an API. See https://setuptools.pypa.io/en/latest/pkg_resources.html"
        ]
      },
      {
        "package": "pytest",
        "indicator": "maintenance_activity",
        "severity": "info",
        "evidence": [
          "not checked: no package-index metadata was queried (offline run)"
        ]
      },
      {
        "package": "nose",
        "indicator": "maintenance_activity",
        "severity": "info",
        "evidence": [
          "not checked: no package-index metadata was queried (offline run)"
        ]
      },
      {
        "package": "toml",
        "indicator": "maintenance_activity",
        "severity": "info",
        "evidence": [
          "not checked: no package-index metadata was queried (offline run)"
        ]
      },
      {
        "package": "appdirs",
        "indicator": "maintenance_activity",
        "severity": "info",
        "evidence": [
          "not checked: no package-index metadata was queried (offline run)"
        ]
      },
      {